{
  "$schema": "https://json-schema.org/draft/2020-12/schema",
  "title": "IntentPacket",
  "type": "object",
  "required": ["kind"],
  "properties": {
    "kind": { "const": "intent" },
    "intent_type": { "type": "string" },
    "intent_id": { "type": "string" },
    "correlation_id": { "type": "string" },
    "conversation_id": { "type": "string" },
    "message_id": { "type": "string" },
    "natural_language": { "type": "string" },
    "fields": { "type": "object", "additionalProperties": true },
    "confidence": { "type": "number" },
    "source": { "type": "string" },
    "timestamp": { "type": "string", "format": "date-time" }
  },
  "additionalProperties": true
}
